name,title,specialty,bio,is_featured,display_order
Dr. Emily Carter,"DVM, Chief Veterinarian",Small Animal Medicine & Internal Medicine,Dr. Carter has over 15 years of experience in small animal medicine. She leads our clinical team and is passionate about preventive care and building long-term relationships with patients and their families.,true,1
Dr. Jessica Lee,"DVM, DABVP (Feline)",Feline & Exotic Animal Specialist,Dr. Lee is our feline and exotic animal expert with board certification from the American Board of Veterinary Practitioners. She has a special interest in cat-friendly handling techniques and exotic species.,true,2
Dr. Marcus Reed,"DVM, DACVS",Surgery & Orthopaedics,Dr. Reed is our lead surgeon with board certification in veterinary surgery. He specialises in orthopaedic procedures soft tissue surgery and minimally invasive techniques.,true,3
Dr. Sophia Nguyen,"DVM, MS",Dermatology & Nutrition,Dr. Nguyen completed her residency in veterinary dermatology and holds a Master's in clinical nutrition. She manages complex allergy cases skin disorders and nutritional consultations.,true,4
Dr. James Thornton,DVM,Preventive Care & Vaccination,Dr. Thornton joined PawClinic in 2020 with a focus on preventive medicine and community health. He is known for his gentle approach with anxious patients and thorough wellness consultations.,false,5
Dr. Priya Sharma,"DVM, DACVIM (Oncology)",Oncology & Diagnostics,Dr. Sharma is our oncology specialist helping pets and their families navigate cancer diagnoses with compassion and expertise. She coordinates closely with our diagnostic imaging team.,false,6
